{
  "$schema": "https://json-schema.org/draft/2020-12/schema",
  "$id": "urn:sacs:v0.6:acceptance-matrix",
  "title": "SACS v0.6 Acceptance Matrix",
  "type": "object",
  "additionalProperties": false,
  "required": [
    "schemaVersion",
    "packageId",
    "generatedAt",
    "tracks",
    "rows"
  ],
  "properties": {
    "schemaVersion": {
      "const": "sacs-v06-acceptance-matrix/1.0"
    },
    "packageId": {
      "type": "string",
      "minLength": 1
    },
    "generatedAt": {
      "type": "string",
      "format": "date-time"
    },
    "tracks": {
      "type": "object",
      "minProperties": 3
    },
    "rows": {
      "type": "array",
      "minItems": 1,
      "items": {
        "type": "object",
        "additionalProperties": false,
        "required": [
          "id",
          "phase",
          "track",
          "title",
          "requirement",
          "required",
          "severityOnFailure",
          "evidenceRequired",
          "allowedStatuses",
          "initialStatus"
        ],
        "properties": {
          "id": {
            "type": "string",
            "pattern": "^V06-S[0-9]{2}-[0-9]{3}$"
          },
          "phase": {
            "enum": [
              "S00",
              "S01",
              "S02",
              "S03",
              "S04",
              "S05",
              "S06",
              "S07",
              "S08",
              "S09"
            ]
          },
          "track": {
            "enum": [
              "DEVELOPMENT",
              "REAL_WSGS_INTEGRATION",
              "RELEASE"
            ]
          },
          "title": {
            "type": "string",
            "minLength": 1
          },
          "requirement": {
            "type": "string",
            "minLength": 1
          },
          "required": {
            "type": "boolean"
          },
          "conditionalOn": {
            "type": [
              "string",
              "null"
            ]
          },
          "severityOnFailure": {
            "enum": [
              "CRITICAL",
              "MAJOR",
              "MINOR"
            ]
          },
          "evidenceRequired": {
            "type": "array",
            "minItems": 1,
            "items": {
              "type": "string",
              "minLength": 1
            }
          },
          "allowedStatuses": {
            "type": "array",
            "items": {
              "enum": [
                "PASS",
                "FAIL",
                "BLOCKED_EXTERNAL",
                "NOT_RUN",
                "NOT_REQUESTED"
              ]
            },
            "uniqueItems": true
          },
          "initialStatus": {
            "enum": [
              "NOT_RUN",
              "NOT_REQUESTED"
            ]
          }
        }
      }
    }
  }
}
