{
  "schemaVersion": "sacs-v06-acceptance-matrix/1.0",
  "packageId": "sacs-v0.6-wsgs-full-functional-integration-codex-goal",
  "generatedAt": "2026-09-06T05:32:35Z",
  "tracks": {
    "DEVELOPMENT": {
      "completionMarker": "SACS_WSGS_FULL_FUNCTIONAL_INTEGRATION_DEV_READY",
      "blockedExternalAllowedForConditionalRows": false
    },
    "REAL_WSGS_INTEGRATION": {
      "completionMarker": "SACS_WSGS_GROUNDING_JOB_REAL_INTEGRATION_READY",
      "blockedExternalAllowedForConditionalRows": true
    },
    "RELEASE": {
      "completionMarker": "SACS_V06_RELEASE_QUALIFIED",
      "requiresExplicitUserAuthorization": true
    }
  },
  "rows": [
    {
      "id": "V06-S00-001",
      "phase": "S00",
      "track": "DEVELOPMENT",
      "title": "Task package integrity",
      "requirement": "The extracted task package passes scripts/verify_task_package.py and its external ZIP SHA-256 is recorded.",
      "required": true,
      "conditionalOn": null,
      "severityOnFailure": "CRITICAL",
      "evidenceRequired": [
        "command",
        "hash"
      ],
      "allowedStatuses": [
        "PASS",
        "FAIL",
        "BLOCKED_EXTERNAL",
        "NOT_RUN",
        "NOT_REQUESTED"
      ],
      "initialStatus": "NOT_RUN"
    },
    {
      "id": "V06-S00-002",
      "phase": "S00",
      "track": "DEVELOPMENT",
      "title": "Clean source intake",
      "requirement": "The original worktree status, uncommitted changes and untracked files are captured before mutation; existing user work is preserved.",
      "required": true,
      "conditionalOn": null,
      "severityOnFailure": "CRITICAL",
      "evidenceRequired": [
        "git-status",
        "report"
      ],
      "allowedStatuses": [
        "PASS",
        "FAIL",
        "BLOCKED_EXTERNAL",
        "NOT_RUN",
        "NOT_REQUESTED"
      ],
      "initialStatus": "NOT_RUN"
    },
    {
      "id": "V06-S00-003",
      "phase": "S00",
      "track": "DEVELOPMENT",
      "title": "v0.5-capable base selected",
      "requirement": "The selected SACS base contains the v0.5 analysis contracts, persistence, pump, AG-UI v0.3, fixture adapter and progressive verification.",
      "required": true,
      "conditionalOn": null,
      "severityOnFailure": "CRITICAL",
      "evidenceRequired": [
        "git-sha",
        "inventory",
        "tests"
      ],
      "allowedStatuses": [
        "PASS",
        "FAIL",
        "BLOCKED_EXTERNAL",
        "NOT_RUN",
        "NOT_REQUESTED"
      ],
      "initialStatus": "NOT_RUN"
    },
    {
      "id": "V06-S00-004",
      "phase": "S00",
      "track": "DEVELOPMENT",
      "title": "Exact SACS source lock",
      "requirement": "SOURCE_LOCK records the exact SACS repository, base branch, commit SHA and tree cleanliness.",
      "required": true,
      "conditionalOn": null,
      "severityOnFailure": "CRITICAL",
      "evidenceRequired": [
        "source-lock"
      ],
      "allowedStatuses": [
        "PASS",
        "FAIL",
        "BLOCKED_EXTERNAL",
        "NOT_RUN",
        "NOT_REQUESTED"
      ],
      "initialStatus": "NOT_RUN"
    },
    {
      "id": "V06-S00-005",
      "phase": "S00",
      "track": "DEVELOPMENT",
      "title": "Exact WSGS source lock",
      "requirement": "SOURCE_LOCK records WSGS main and any selected handoff branch SHA without assuming the package-generation observation is current.",
      "required": true,
      "conditionalOn": null,
      "severityOnFailure": "CRITICAL",
      "evidenceRequired": [
        "source-lock"
      ],
      "allowedStatuses": [
        "PASS",
        "FAIL",
        "BLOCKED_EXTERNAL",
        "NOT_RUN",
        "NOT_REQUESTED"
      ],
      "initialStatus": "NOT_RUN"
    },
    {
      "id": "V06-S00-006",
      "phase": "S00",
      "track": "DEVELOPMENT",
      "title": "WSGS 1.1 artifact verification",
      "requirement": "The authoritative WSGS 1.1 release lock and every consumed schema artifact are verified from raw bytes and SHA-256.",
      "required": true,
      "conditionalOn": null,
      "severityOnFailure": "CRITICAL",
      "evidenceRequired": [
        "artifact-hashes",
        "command"
      ],
      "allowedStatuses": [
        "PASS",
        "FAIL",
        "BLOCKED_EXTERNAL",
        "NOT_RUN",
        "NOT_REQUESTED"
      ],
      "initialStatus": "NOT_RUN"
    },
    {
      "id": "V06-S00-007",
      "phase": "S00",
      "track": "DEVELOPMENT",
      "title": "Safe feature branch",
      "requirement": "Work occurs on codex/sacs-v0.6-wsgs-full-functional-integration or a non-destructive equivalent; no published history is rewritten.",
      "required": true,
      "conditionalOn": null,
      "severityOnFailure": "MAJOR",
      "evidenceRequired": [
        "git-branch",
        "git-log"
      ],
      "allowedStatuses": [
        "PASS",
        "FAIL",
        "BLOCKED_EXTERNAL",
        "NOT_RUN",
        "NOT_REQUESTED"
      ],
      "initialStatus": "NOT_RUN"
    },
    {
      "id": "V06-S00-008",
      "phase": "S00",
      "track": "DEVELOPMENT",
      "title": "Initial acceptance ledger",
      "requirement": "Every acceptance row is present exactly once and initialized to NOT_RUN or NOT_REQUESTED as specified.",
      "required": true,
      "conditionalOn": null,
      "severityOnFailure": "MAJOR",
      "evidenceRequired": [
        "ledger-validation"
      ],
      "allowedStatuses": [
        "PASS",
        "FAIL",
        "BLOCKED_EXTERNAL",
        "NOT_RUN",
        "NOT_REQUESTED"
      ],
      "initialStatus": "NOT_RUN"
    },
    {
      "id": "V06-S00-009",
      "phase": "S00",
      "track": "DEVELOPMENT",
      "title": "Product-boundary reconciliation",
      "requirement": "Root AGENTS/Codex guidance is updated so existing AG-UI/WSGS responsibilities are not contradicted while SDAR boundaries remain intact.",
      "required": true,
      "conditionalOn": null,
      "severityOnFailure": "MAJOR",
      "evidenceRequired": [
        "diff",
        "review"
      ],
      "allowedStatuses": [
        "PASS",
        "FAIL",
        "BLOCKED_EXTERNAL",
        "NOT_RUN",
        "NOT_REQUESTED"
      ],
      "initialStatus": "NOT_RUN"
    },
    {
      "id": "V06-S00-010",
      "phase": "S00",
      "track": "DEVELOPMENT",
      "title": "Baseline verification",
      "requirement": "The selected source passes the available v0.5 focused, typecheck, migration and architecture baseline or failures are explicitly recorded before implementation.",
      "required": true,
      "conditionalOn": null,
      "severityOnFailure": "CRITICAL",
      "evidenceRequired": [
        "commands",
        "exit-codes"
      ],
      "allowedStatuses": [
        "PASS",
        "FAIL",
        "BLOCKED_EXTERNAL",
        "NOT_RUN",
        "NOT_REQUESTED"
      ],
      "initialStatus": "NOT_RUN"
    },
    {
      "id": "V06-S01-001",
      "phase": "S01",
      "track": "DEVELOPMENT",
      "title": "Analysis source mode contract",
      "requirement": "A strict source-mode contract distinguishes WSGS_GROUNDING_JOB, WSGS_NATIVE_ANALYSIS, FIXTURE and read-only LEGACY_PLAN.",
      "required": true,
      "conditionalOn": null,
      "severityOnFailure": "CRITICAL",
      "evidenceRequired": [
        "contract-test",
        "code"
      ],
      "allowedStatuses": [
        "PASS",
        "FAIL",
        "BLOCKED_EXTERNAL",
        "NOT_RUN",
        "NOT_REQUESTED"
      ],
      "initialStatus": "NOT_RUN"
    },
    {
      "id": "V06-S01-002",
      "phase": "S01",
      "track": "DEVELOPMENT",
      "title": "Truthful source identity union",
      "requirement": "Source identity uses source kind/id/hash and optional source revision/run identity; Grounding IDs are not typed as plan IDs.",
      "required": true,
      "conditionalOn": null,
      "severityOnFailure": "CRITICAL",
      "evidenceRequired": [
        "contract-test",
        "code-review"
      ],
      "allowedStatuses": [
        "PASS",
        "FAIL",
        "BLOCKED_EXTERNAL",
        "NOT_RUN",
        "NOT_REQUESTED"
      ],
      "initialStatus": "NOT_RUN"
    },
    {
      "id": "V06-S01-003",
      "phase": "S01",
      "track": "DEVELOPMENT",
      "title": "Source adapter interface",
      "requirement": "A single AnalysisSourceAdapter contract covers start/get/observe/cancel/revise/resolveChoice without hiding transport truth.",
      "required": true,
      "conditionalOn": null,
      "severityOnFailure": "MAJOR",
      "evidenceRequired": [
        "contract-test",
        "api-review"
      ],
      "allowedStatuses": [
        "PASS",
        "FAIL",
        "BLOCKED_EXTERNAL",
        "NOT_RUN",
        "NOT_REQUESTED"
      ],
      "initialStatus": "NOT_RUN"
    },
    {
      "id": "V06-S01-004",
      "phase": "S01",
      "track": "DEVELOPMENT",
      "title": "Existing native behavior preserved",
      "requirement": "The five existing Native WSGS analysis ports remain available behind the new abstraction and retain fail-closed authorization.",
      "required": true,
      "conditionalOn": null,
      "severityOnFailure": "CRITICAL",
      "evidenceRequired": [
        "regression-test"
      ],
      "allowedStatuses": [
        "PASS",
        "FAIL",
        "BLOCKED_EXTERNAL",
        "NOT_RUN",
        "NOT_REQUESTED"
      ],
      "initialStatus": "NOT_RUN"
    },
    {
      "id": "V06-S01-005",
      "phase": "S01",
      "track": "DEVELOPMENT",
      "title": "Fixture behavior preserved",
      "requirement": "The fixture adapter implements the new abstraction without becoming production eligible.",
      "required": true,
      "conditionalOn": null,
      "severityOnFailure": "CRITICAL",
      "evidenceRequired": [
        "unit-test",
        "production-negative"
      ],
      "allowedStatuses": [
        "PASS",
        "FAIL",
        "BLOCKED_EXTERNAL",
        "NOT_RUN",
        "NOT_REQUESTED"
      ],
      "initialStatus": "NOT_RUN"
    },
    {